<?xml version="1.0" encoding="UTF-8" standalone="yes"?>
<CompositionRulesConfiguration xmlns:xsi="http://www.w3.org/2001/XMLSchema-instance"
                  xsi:noNamespaceSchemaLocation="compositionRules.xsd">
    
    <MetricsCompositionRules>
        <CompositionRule TargetMonitoredElementLevel="SERVICE_UNIT">
            <ResultingMetric type="RESOURCE" measurementUnit="no" name="activeConnections"/>
            <Operation MetricSourceMonitoredElementLevel="VM" type="AVG">
                <ReferenceMetric type="RESOURCE" name="activeConnections"/>
            </Operation>
        </CompositionRule>
        <CompositionRule TargetMonitoredElementLevel="SERVICE_UNIT">
            
            <ResultingMetric type="RESOURCE" measurementUnit="%" name="cpuUsage"/>
            <Operation value="100" type="ADD">
                  <Operation value="-1" type="MUL">
                         <Operation MetricSourceMonitoredElementLevel="VM" type="AVG">
                   		 <ReferenceMetric type="RESOURCE" measurementUnit="%"  name="cpu_idle"/>
                </Operation>
            </Operation>
            </Operation>
        </CompositionRule>
        <CompositionRule TargetMonitoredElementLevel="SERVICE_UNIT">
            <ResultingMetric type="RESOURCE" measurementUnit="%" name="cpuUsage"/>
            <Operation value="100" type="ADD">
                  <Operation value="-1" type="MUL">
                         <Operation MetricSourceMonitoredElementLevel="VM" type="AVG">
                   		 <ReferenceMetric type="RESOURCE" measurementUnit="%" name="cpu_idle"/>
                </Operation>
            </Operation>
            </Operation>
        </CompositionRule>
      
            
        <CompositionRule TargetMonitoredElementLevel="SERVICE_UNIT">
            <ResultingMetric type="RESOURCE" measurementUnit="ms" name="responseTime"/>
            <Operation MetricSourceMonitoredElementLevel="VM" type="AVG">
                <ReferenceMetric type="RESOURCE" name="responseTime"/>
            </Operation>
        </CompositionRule>

 
    	 <CompositionRule TargetMonitoredElementLevel="SERVICE_UNIT">
			<ResultingMetric type="RESOURCE" measurementUnit="ms" name="latency" />
			<Operation MetricSourceMonitoredElementLevel="VM" type="AVG">
				<Operation MetricSourceMonitoredElementLevel="VM" type="AVG">
					<ReferenceMetric type="RESOURCE" name="read_latency" />
				</Operation>
				<Operation MetricSourceMonitoredElementLevel="VM" type="AVG">
					<ReferenceMetric type="RESOURCE" name="write_latency" />
				</Operation>
			</Operation>
			</CompositionRule>
			<CompositionRule TargetMonitoredElementLevel="SERVICE_UNIT">
				<ResultingMetric type="RESOURCE" measurementUnit="ms" name="latency" />
				<Operation MetricSourceMonitoredElementLevel="VM" type="AVG">
					<Operation MetricSourceMonitoredElementLevel="VM" type="AVG">
						<ReferenceMetric type="RESOURCE" name="read_latency" />
					</Operation>
					<Operation MetricSourceMonitoredElementLevel="VM" type="AVG">
						<ReferenceMetric type="RESOURCE" name="write_latency" />
					</Operation>
				</Operation>
			</CompositionRule>
 
        <CompositionRule TargetMonitoredElementLevel="SERVICE_UNIT">
            <ResultingMetric type="RESOURCE" measurementUnit="operations/s" name="throughput"/>
            <Operation MetricSourceMonitoredElementLevel="VM" type="SUM">
                <ReferenceMetric type="RESOURCE" name="throughput"/>
             </Operation>
        </CompositionRule>
        
        <CompositionRule TargetMonitoredElementLevel="SERVICE_UNIT">
            <ResultingMetric name="avgThroughput" measurementUnit="operations/s" type="QUALITY"/>
             <Operation MetricSourceMonitoredElementLevel="VM" type="AVG">
                <ReferenceMetric type="RESOURCE" name="throughput"/>
             </Operation>
        </CompositionRule>
        
     
         <CompositionRule TargetMonitoredElementLevel="VM">
            <ResultingMetric type="RESOURCE" measurementUnit="ms" name="numberOfVMs"/>
            <Operation value="1" type="SET_VALUE"/>
        </CompositionRule>

 
        <CompositionRule TargetMonitoredElementLevel="SERVICE_UNIT">
            <ResultingMetric type="RESOURCE" measurementUnit="ms" name="numberOfVMs"/>
            <Operation MetricSourceMonitoredElementLevel="VM" type="SUM">
                <ReferenceMetric type="RESOURCE" name="numberOfVMs"/>
            </Operation>
        </CompositionRule>

       <CompositionRule TargetMonitoredElementLevel="SERVICE_UNIT">
            <ResultingMetric type="RESOURCE" measurementUnit="$" name="cost"/>
            <Operation MetricSourceMonitoredElementLevel="SERVICE_UNIT" value="0.12" type="MUL">
			       <ReferenceMetric type="RESOURCE" name="numberOfVMs"/>
            </Operation>
        </CompositionRule>
 
        
         <CompositionRule TargetMonitoredElementLevel="SERVICE_TOPOLOGY">
            <ResultingMetric type="QUALITY" measurementUnit="ms" name="latency"/>
            <Operation MetricSourceMonitoredElementLevel="SERVICE_UNIT" type="KEEP">
                <ReferenceMetric type="QUALITY" measurementUnit="ms" name="latency"/>
            </Operation>
        </CompositionRule>
         <CompositionRule TargetMonitoredElementLevel="SERVICE_TOPOLOGY">
            <ResultingMetric type="RESOURCE" measurementUnit="%" name="cpuUsage"/>
            <Operation MetricSourceMonitoredElementLevel="SERVICE_UNIT" type="AVG">
                <ReferenceMetric type="RESOURCE" measurementUnit="%" name="cpuUsage"/>
            </Operation>
        </CompositionRule>
        <CompositionRule TargetMonitoredElementLevel="SERVICE_TOPOLOGY">
            <ResultingMetric type="RESOURCE" measurementUnit="ms" name="responseTime"/>
            <Operation MetricSourceMonitoredElementLevel="SERVICE_UNIT" type="AVG">
                <ReferenceMetric type="RESOURCE" name="responseTime"/>
            </Operation>
        </CompositionRule>
        <CompositionRule TargetMonitoredElementLevel="SERVICE_TOPOLOGY">
            <ResultingMetric type="RESOURCE" measurementUnit="operations/s" name="throughput"/>
            <Operation MetricSourceMonitoredElementLevel="SERVICE_UNIT" type="SUM">
                <ReferenceMetric type="RESOURCE" name="throughput"/>
            </Operation>
        </CompositionRule>
        
        
        <CompositionRule TargetMonitoredElementLevel="SERVICE_TOPOLOGY">
            <ResultingMetric type="RESOURCE" measurementUnit="operations/s" name="avgThroughput"/>
            <Operation MetricSourceMonitoredElementLevel="SERVICE_UNIT" type="SUM">
                <ReferenceMetric type="RESOURCE" name="avgThroughput"/>
            </Operation>
        </CompositionRule>
        
        
        
        
        
        <CompositionRule TargetMonitoredElementLevel="SERVICE_TOPOLOGY">
            <ResultingMetric type="RESOURCE" measurementUnit="$/h" name="cost"/>
                <Operation MetricSourceMonitoredElementLevel="SERVICE_UNIT" type="SUM">
                    <ReferenceMetric type="COST" name="cost"/>
                </Operation>
        </CompositionRule>

          <CompositionRule TargetMonitoredElementLevel="SERVICE">
            <Operation type="MUL">
                    <Operation type="DIV">
		           <Operation MetricSourceMonitoredElementLevel="SERVICE_TOPOLOGY" type="SUM">
		               <ReferenceMetric type="COST" measurementUnit="$/h" name="cost"/>
		           </Operation>
	 
		            <Operation MetricSourceMonitoredElementLevel="SERVICE_UNIT" type="KEEP">
		               <ReferenceMetric type="RESOURCE" measurementUnit="operations/s" name="throughput"/>
		            </Operation>
                       
                    </Operation>
                    <Operation MetricSourceMonitoredElementLevel="SERVICE_UNIT" type="DIV">
                       <Operation value="1000" type="SET_VALUE"/>   
                       <Operation value="360" type="SET_VALUE"/>   
                    </Operation>   
                 </Operation>   
                <ResultingMetric type="COST" measurementUnit="$/1000ops" name="cost"/>

        </CompositionRule>

    </MetricsCompositionRules>
     
</CompositionRulesConfiguration>

